"The objective of this research is to create a generic advanced Flight Management System (FMS) platform that could be used for evaluation of autonomous trajectory-based operation concepts. The research addresses the following deficiencies: most FMSs have limited advanced features; are specific to a single aircraft type; expensive and protected by FMS manufacturers. The proposed FMS platform will enable users to deploy a wide array of autonomy enabling FMS features by the click of a button. Some of the proposed features include: (i) air-ground & inter-aircraft trajectory negotiation, (ii) 4D Trajectory-Based Operations (4DTBO), (iii) high-fidelity wind modeling for improved predictability, (iii) trajectory planning options based on environmental and efficiency considerations, and (iv) advanced guidance modes such as Required Time of Arrival (RTA) and 4DFMS. A key feature of the proposed research is the integration of this platform and its features with NASA's Multi-AirCraft Simulation (MACS) platform.

Phase I research will identify the complete array of features for possible inclusion in this platform. Moreover, Phase I will demonstrate select features through the interface to MACS. Phase II research will elevate the technology readiness level suitable for deployment in Human-In-The-Loop simulation pilot stations."
"The Ocean Biology DAAC produces near real-time (quicklook) products using the best-available combination of ancillary data from meteorological and ozone data. As such, the inputs and the calibration used are less than optimal. Quicklook products provide a snapshot of the data during a short time period within a single orbit."
"FIREXAQ_TraceGas_AircraftRemoteSensing_ER2_SHIS_Data are remotely sensed measurements collected by the Scanning High-Resolution Interferometer Sounder (S-HIS) onboard the ER-2 aircraft. Completed during summer 2019, FIREX-AQ utilized a combination of instrumented airplanes, satellites, and ground-based instrumentation. Detailed fire plume sampling was carried out by the NASA DC-8 aircraft, which had a comprehensive instrument payload capable of measuring over 200 trace gas species, as well as aerosol microphysical, optical, and chemical properties. The DC-8 aircraft completed 23 science flights, including 15 flights from Boise, Idaho and 8 flights from Salina, Kansas. NASA’s ER-2 completed 11 flights, partially in support of the FIREX-AQ effort. The ER-2 payload was made up of 8 satellite analog instruments and provided critical fire information, including fire temperature, fire plume heights, and vegetation/soil albedo information. A ground-based mobile lab provided in-situ measurements of aerosol microphysical and optical properties, aerosol chemical compositions, and trace gas species.The Fire Influence on Regional to Global Environments and Air Quality (FIREX-AQ) campaign was a NOAA/NASA interagency intensive study of North American fires to gain an understanding on the integrated impact of the fire emissions on the tropospheric chemistry and composition and to assess the satellite’s capability for detecting fires and estimating fire emissions. The overarching goal of FIREX-AQ was to provide measurements of trace gas and aerosol emissions for wildfires and prescribed fires in great detail, relate them to fuel and fire conditions at the point of emission, characterize the conditions relating to plume rise, and follow plumes downwind to understand chemical transformation and air quality impacts."
"By the end of this year, we intend to have a two inch diameter, operational test article which continuously generates a symmetric plasma discharge. We intend to ensure this symmetry by adding a magnet to the original one inch diameter design which was used to demonstrate this shock wave attenuation effect in an earlier wind tunnel test. We will be testing a slightly larger model in order to better instrument the test article. This larger model will also add to our understanding of how the size of the model affects the amount of power needed to attenuate the shock waves. We also intend to demonstrate that the discharge from this new model significantly attenuates any shock waves generated at flight relevant conditions in a supersonic wind tunnel. The next step after this year is to mount this test article to the ""Big Red"" flight test fixture underneath a NASA F15, fly at Mach 1.6 at 31kft, 32kft and 33kft and possibly Mach 1.8 at 33kft. And use AirBOS to image the shockwaves coming off of the model with plasma on and plasma off."
"The SLSTR/Sentinel-3B L1 Full Resolution Top of Atmosphere Radiances and Brightness Temperature product with shortname S3B_SL_1_RBT, is generated from the data acquired by the Sea and Land Surface Temperature Radiometer (SLSTR), on-board SENTINEL-3, is a dual scan temperature radiometer. The principal aim of the SLSTR instrument is to maintain continuity with the AATSR series of instruments. The SLSTR instrument design incorporates the basic functionality of AATSR in addition to new, more advanced features including a wider swath, new channels (including two channels dedicated to fire detection), and higher resolution in some channels. The principal objective of SLSTR products is to provide global and regional Sea and Land Surface Temperature (SST, LST) to a very high level of accuracy (better than 0.3 K) for both climatological and meteorological applications.

For more information about the instrument and the mission, visit ""Sentinel Online"" at https://sentinel.esa.int/web/sentinel/home. 

The S3B_SL_1_RBT is a Level 1B product which consist of full resolution, geolocated, co-located nadir and along track view, Top of Atmosphere (TOA) brightness temperatures (in the case of thermal IR channels) or radiances (in the case of visible, NIR and SWIR channels) from all SLSTR channels. It also contains quality flags, pixel classification information and meteorological annotations. Based on components activated by configuration which are not part of the operational production baseline, the S3B_SL_1_RBT may contain 77 or 111 files. Out of the these files, 22 or 34 files contain the actual measurements, where the other 54 or 76 files contain the annotations data.

For more information about the product, read the SENTINEL-3 SLSTR User Guide at https://sentinel.esa.int/web/sentinel/user-guides/sentinel-3-slstr"
"To date, the majority of the gearboxes used on the rovers have been based on very conventional materials, process and designs.  This has primarily been a result of the fast paced schedules associated with rover development.  With little time for recovery, these programs are extremely risk adverse and the idea of developing new technology on the program is absolutely impractical.  As there is no rover planned for the 2007 there is a longer than normal dwell between rover programs.  The hope is to capitalize on this time to advance the technology used on the common gearboxes employed on the rover.  This will allow new technology to be introduced into the gearbox designs.  
The plan for reducing the gearbox mass relies on a three pronged approach.  First, design innovations above and beyond AGMA standards will be evaluated for incorporation into the basic planetary gearbox design.  Second, advanced materials and processes will be evaluated for use in gears and planet bearings.  And lastly, the cost implications of the advanced technology will be compiled to insure the correct balance is maintained between weight reduction and cost expense."
"Mars Pathfinder bounced down and rolled to a stop on the surface of Mars on July 4, 1997. It landed in an ancient floodplain in the Ares Vallis region of Chryse Planitia at 19.1 degrees North Areocentric latitude, and 326.48 degrees East longitude."
"This dataset provides the Carbon Flux for Prior Total Carbon.

The NASA Carbon Monitoring System (CMS) is designed to make significant contributions in characterizing, quantifying, understanding, and predicting the evolution of global carbon sources and sinks through improved monitoring of carbon stocks and fluxes. The System will use the full range of NASA satellite observations and modeling/analysis capabilities to establish the accuracy, quantitative uncertainties, and utility of products for supporting national and international policy, regulatory, and management activities. CMS will maintain a global emphasis while providing finer scale regional information, utilizing space-based and surface-based data and will rapidly initiate generation and distribution of products both for user evaluation and to inform near-term policy development and planning."
"Arctic Slope Technical Services, ASTS, is pleased to propose this innovative approach for reducing the cost and power requirements for an electrically-heated, stored gas thruster well-suited for use in small spacecraft and satellites (CubeSats and NanoSats especially).  The thruster features exceptionally-high heat transfer from the heaters to the gas, which will provide excellent Isp performance at much lower power than traditional thrusters.  We will also use an additive manufacturing approach, which will greatly reduce production costs."
"We have developed a prototype instrument called “Standoff Biofinder” which is able to detect biomolecules and bio-markers from a collection of rocks and minerals in a large area with detection time of 0.1 s. The Standoff Biofinder takes advantage of the short lifetime of bio-fluorescent materials to obtain real-time images showing the locations of biological materials among luminescent minerals in a geological context. The instrument works in daylight as well as nighttime conditions and bio-detection capability is not affected by the background light. The Standoff Biofinder instrument will be suitable for locating fluorescent polyaromatic hydrocarbons, amino acids, proteins, bacteria, biominerals, photosynthetic pigments, and diagenetic products of microbial life both on dry landscapes as well as on Ocean Worlds of the outer Solar System (e.g., Enceladus, Europa, and Titan).
	At present, the images provided by the prototype biofinder are black and white images displaying the morphology and concentrations of biological molecules. In this proposal, we propose to develop the next generation of the instrument, “Compact Color Biofinder” (CoCoBi) which will provide color fluorescent images of biological species in a target area.  One of the advantages of the color biofinder over the present biofinder system would be ability to differentiate multiple biological materials in a target area which may contain a mixture of biological species in various concentrations. CoCoBi will be helpful in identifying the biological materials based on their fluorophore colors, along with morphologies and concentrations.  In addition, the color-biofinder will be significantly miniaturized in size and will be an ideal “search for life” future mission instrument. CoCoBi will be designed to look for ppm levels of biomaterial from a standoff distance of several centimeters in a geological setting, as well as in water and ice, with detection time less than 1 s. An important feature of the Standoff Biofinder instrument is its capability to detect biomolecules which are deeper in water and ice, without sample collection. The CoCoBi instrument will be useful for locating a biological material during future NASA rover, lander, and crewed missions to Moon, Mars, Jupiter, Venus, Enceladus, Europa, Titan, asteroids etc. Additionally, the instrument can be used for non-contact, non-destructive detection of biological materials in priceless samples obtained from sample return missions from other planets and asteroids.
	Under this project, the TRL of the proposed compact color biofinder instrument will advance from TRL 2 to TRL 4."
"This project will develop a much-needed multidisciplinary analysis tool for predicting the impact of aeroelastic effects on the functionality of inflatable aeroassist vehicles in both the continuum and rarefied flow regimes.  In this integrated multi-physics multi-disciplinary computing environment,  high-fidelity modules for continuum and rarefied aerodynamics, stress, heat transfer, and computational grid deformation are coupled. This flexible and extensible approach allows the integration of state-of-the-art, stand-alone NASA and industry leading continuum and rarefied flow solvers and structural analysis codes into a computing environment in which the modules can run concurrently with synchronized data transfer. 

The Phase I study proved the feasibilty of this approach. Tightly coupled fluid-structure continuum flow demonstrations were conducted on a clamped ballute configuration. The feasibility of implementing a DSMC flow solver in the simulation framework was demonstrated, and loosely coupled rarefied flow aeroelastic demonstrations were performed. A NASA and industry technology survey identified several software tools for fluid and structural modeling to be integrated into the environment. Phase II efforts will focus on full implementation of these tools. They include NASA-selected CFD and DSMC codes, and commercial leading structural analysis codes capable of modeling non-linear shape and material response of thin-film inflated aeroshells. Extensive verification and validation studies will be performed, and the software will be applied in ballute technology development."
"The differences between the observations and the forecast background used for the analysis (the innovations or O-F for short) and those between the observations and the final analysis (O-A) are by-products of any assimilation system and provide information about the quality of the analysis and the impact of the observations. Innovations have been traditionally used to diagnose observation, background and analysis errors at observation locations (Hollingsworth and Lonnberg 1989; Dee and da Silva 1999). At the most simplistic level, innovation variances can be used as an upper bound on background errors, which are, in turn, an upper bound on the analysis errors. With more processing (and the assumption of optimality), the O-F and O-A statistics can be used to estimate observation, background and analysis errors (Desroziers et al. 2005). They can also be used to estimate the systematic and random errors in the analysis fields. Unfortunately, such data are usually not readily available with reanalysis products. With MERRA, however, a gridded version of the observations and innovations used in the assimilation process is being made available. The dataset allows the user to conveniently perform investigations related to the observing system and to calculate error estimates. Da Silva (2011) provides an overview and analysis of these datasets for MERRA. 
			
			The innovations may be thought of as the correction to the background required by a given instrument, while the analysis increment (A-F) is the consolidated correction once all instruments, observation errors, and background errors have been taken into consideration. The extent to which the O-F statistics for the various instruments are similar to the A-F statistics reflects the degree of homogeneity of the observing system as a whole. Using the joint probability density function (PDF) of innovations and analysis increments, da Silva (2011) introduces the concepts of the effective gain (by analogy with the Kalman gain) and the contextual bias. In brief, the effective gain for an observation is a measure of how much the assimilation system has drawn to that type of observation, while the contextual bias is a measure of the degree of agreement between a given observation type and all other observations assimilated.
			
			With MERRAs gridded observation and innovation data sets, a wealth of information is available for examination of the quality of the analyses and how the different observations impact the analyses and interact with each other. Such examinations can be conducted regionally or globally and should provide useful information for the next generation of reanalyses."
"This data set contains ice thickness, surface and bed elevation, and echo strength measurements taken over Antarctica using the Hi-Capability Airborne Radar Sounder (HiCARS) instrument. The data were collected by scientists working on the Investigating the Cryospheric Evolution of the Central Antarctic Plate (ICECAP) project, which was funded by the National Science Foundation (NSF) and the Natural Environment Research Council (NERC) with additional support from NASA Operation IceBridge."
"For billions of years, Bacteria and Archaea have formed organized communities in microbial mats. Such cooperation among microbes has played determinative roles in the persistence of life, and provides insight into how life on Earth and elsewhere may respond to and evolve in extreme conditions. 
  A key cooperative mechanism among cells in high density habitats is quorum sensing (QS) using cell-to-cell signals. Genetic evidence suggests QS evolved 3.4 GYA, and was likely important during life's early evolution when extreme environments prevailed. However, QS has not been explored in an astrobiology context, nor in astrobiologically relevant extreme environments, where deep branching microbial lineages thrive. This paucity of data presents a critical knowledge gap.
  We propose to investigate QS in microbial mats in hypersaline systems and lava caves, both analogs of habitats believed to have been present on early Earth and Mars; both also host deep-branching Archaea and Bacteria. Our main hypothesis is that QS signaling contributes to microbial-survival and resiliency under multiple extreme conditions. We will focus specifically on genetic components of QS, and how they drive gene expression during changing extreme conditions. Doing so will establish a solid foundation for understanding QS in mats in extreme environments, analogs of which thrived in early life on Earth. QS is a fundamental life process leading to higher organization and also a critical pathway through which microbes tolerate and adapt to environmental extremes similar to those that prevailed on early Earth and Mars. 
  Objective 1: QS occurs in extreme environments: hypersaline mats and Hawaiian lava caves. H1: QS occurs among phylogenetically diverse Bacteria and Archaea in extreme environments. Acylhomoserine lactones (AHLs) are well-studied signaling molecules that confer important metabolic properties on microbes, but their diversity and activities in microbes in extreme environments are poorly understood. AHL signaling comprises a conserved AHL and a receptor protein (i.e., luxR homolog). Our preliminary data show the presence of AHLs in hypersaline mats. However, additional work is needed to determine if AHL-based QS systems are common in microbial communities in extreme environments. We will investigate genetic bases of AHL-QS and phylogenetic diversities of luxR homologs as possible mechanisms of adaptability in these communities.
	Objective 2: QS confers and enhances survivability under changing extremes in early Earth- and early Mars-like environments. H2: Both the types of signals used by Archaea and Bacteria and resulting gene expression, change as conditions (salinity, desiccation, UV) become more extreme. We posit from our preliminary results that certain signals are less susceptible to degradation than shorter-chain counterparts. We thus predict that cells will utilize more-resilient signals under harsh environmental conditions. This in turn will test the potential for life to adapt to changing environmental extremes, and its implications for life elsewhere. To do so, we will determine changes in levels of gene expression, concentrations and types of AHLs in natural, multi-species mats, and in isolates exposed to varying extreme environmental conditions (high UV CO2, desiccation, salinity) in both a Planetary Environmental Liquid Simulator (PELS) and controlled atmosphere chamber.
	Objective 3:  AHL signals persist over time through extreme environmental changes. H3: QS signals are preserved under extreme conditions (high salinity, desiccation, UV). This contributes to recovery and persistence of cooperative processes in mats. Our preliminary studies show that extracellular osmolytes protect AHLs in natural hypersaline mats during desiccation and UV exposure. When more favorable conditions return, this may elicit community-wide recovery rather than just individual cell survival, and enhance community survival over long periods."
"The objective of this project is to improve human-robot interaction (HRI) in order to enhance the capability of NASA critical missions. This research will focus two top challenges identified by the NASA RTA panel: improving the understanding and expressing of intent between humans and robots and creating supervised autonomous HRI loops. To address these challenges, this proposal will explore the design space of inferring human intent and cognitive state and the design space of improving robot feedback.

This proposal will utilize cutting-edge brain-computer interface (BCI) technology to aid robots in inferring user intent and cognitive state. Recent improvements in BCI allow for the continuous passive monitoring of human features such as attention and cognitive load via low-cost wireless headsets with no need for extra training. Robots armed with such knowledge will improve collaborative control by knowing when it is best to interrupt their human partners to request aid and gaining further contextual task-based knowledge. This information will be combined with other robotic sensors to increase robot understanding of human intent.

This research will also work towards improving the communication channel whereby robots convey information back to human partners. To this end, this research will leverage advances in social and cognitive psychology to imbue robots with the knowledge of and ability to use social cues. These cues, such as gestures and eye gaze, will enhance human-robot collaborative work regardless of task domain by creating more fluid and effective interactions.

Overall, this research will make practical and appreciable gains to NASA's robotic systems by creating closed-loop, intuitive, minimal error human-robot interactions."
Develop a medical decision support system to enable astronauts on long-duration exploration missions to operate autonomously while independent of Earth contact
Investigate feasibility of quantum illumination for secure space communications
"This is a Rosetta Radio Science data set, collected during the COMET ESCORT 3 phase 2015-07-01 to 2015-10-21. It is a Global Gravity measurement at the comet 67P and covers the time 2015-08-27T03:05:35.000 to 2015-08-27T09:55:10.500."
"The TCSP TICOSONDE-AURA 2005 dataset consists of 4 soundings per day (00, 06, 12, and 18 UT) launched from Juan Santamaria International Airport, WMO station 78762, latitude 10 degrees N and 84.2 degrees W. The launch program began at 00 UT on 16 June 2005 and ended 00 UT 24 August 2005. With a very few exceptions, the sondes were Vaiasala model RS92-SGP and the ground station was a DigiCORA MW11 equipped for GPS wind-finding and upgraded for RS92 telemetry. A small number of ascents were made with RS90-AG and RS80-15G sondes. Most ascents were done with 500-g latex balloons filled with hydrogen. Exceptions included 24 ascents at 06 and 18UT in July that were piggybacked on a larger payload consisting of the University of Colorado Cryogenic Frostpoint Hygrometer (CFH) and an ECC ozonesonde. Median termination altitude for all ascents was approximately 26 km. Data were recorded at the maximum MW11 sample rate of one every two seconds. The TCSP mission collected data for research and documentation of cyclogenesis, the interaction of temperature, humidity, precipitation, wind and air pressure that creates ideal birthing conditions for tropical storms, hurricanes and related phenomena. The goal of this mission was to help us better understand how hurricanes and other tropical storms are formed and intensify."
"The GOES-R PLT West Texas Lightning Mapping Array (LMA) dataset consists of total lightning data measured from the West Texas LMA (WTXLMA) network during the GOES-R Post Launch Test (PLT) airborne science field campaign. The GOES-R PLT airborne science field campaign took place in support of the post-launch product validation of the Advanced Baseline Imager (ABI) and the Geostationary Lightning Mapper (GLM). The LMA measures the arrival time of radiation from a lightning discharge at multiple stations and locates the sources of radiation to produce a three-dimensional map of total lightning activity. These data files are available in compressed ASCII files and are available from March 1, 2017 through June 1, 2017."
"This data set contains spot elevation measurements of Greenland, Arctic, and Antarctic sea ice acquired using the NASA Airborne Topographic Mapper (ATM) 4CT3 narrow scan instrumentation. The data were collected as part of Operation IceBridge funded aircraft survey campaigns."
"These Sea Surface Height Anomalies (SSHA) are derived from the Jason-1 Geophysical Data Record (GDR). Jason-1 is an altimetric mission whose instruments make direct observations of the following quantities: altimeter range, significant wave height, ocean radar backscatter cross-section (a measure of wind speed), ionospheric electron content (derived by a simple formula), tropospheric water content, and position relative to the GPS satellite constellation.  Using the various parameter the SSHA can be calculated and are provided in this dataset.  The data are in NetCDF format. This dataset only contains the parameters that are directly related to SSHA."
