"This dataset contains EDITED RAW DATA of the second Earth Flyby (EAR2). The closest approach (CA) took place on November 13, 2007 at 20:57"
"The Cassini Radio Science Dione Gravity Experiment (DIGR1) Raw Data Archive is a time-ordered collection of radio science raw data acquired on October 10, 11, 12, 2005 during the Tour subphase of the Cassini mission. DATA_SET_DESC ="
"AERONET inversion code provides aerosoloptical properties in the total atmospheric column derived from the direct and diffuse radiation measured byAERONETCimel sun/sky-radiometers. AERONET inversion developmentand researchactivitiesare described in the papers by Dubovik and King, [2000], Dubovik et al. [2000], Dubovik et al. [2002a], Dubovik et al. [2002b], Dubovik et al., [2006a], Sinyuk et al. [2006]. The Version 2(V2)inversion (or retrieval)products are summarized below. These products are available through the internal analysis system&#x0022;demonstrat&#x0022; and the AERONET website. Adetailed description of V2 AERONET retrieval will be provided in the paper by Dubovik et al., [2006b]."
"In Phase Sunpower looked at Thermoacoustic Stirling Heat Engines (TASHEs).  These ranged from a TASHE which was sized for the heat from a single General Purpose Heat Source (GPHS), to a larger unit sized for a Venus mission.  We also looked at different types of cooler to produce both electrical power and sensor cooling for the Venus application.  Computer projected performance and layout drawing were created for all the machines investigated.   In Phase II we plan to fabricate, test, and develop the single-GPHS sized coaxial. TASHE designed in Phase I."
"The UARS Particle Environment Monitor (PEM) level 2 Atmosphere X-Ray Imaging Spectrometer (AXIS) unit 1 daily product contains the X-ray high-resolution spectral data converted to number intensity units from the AXIS1 pixels mounted on the UARS body. PEM was flown on the UARS spacecraft to measure the type, amount, energy, and distribution of charged particles injected into the Earth's thermosphere, mesosphere, and stratosphere.

The PEM AXIS1 X-ray data cover roughly the energy range from 2 keV to 300 keV. There are eight AXIS1 pixels mounted in the AXIS1 housing, each viewing different directions. The AXIS1 pixels are aligned on the spacecraft to project about 45 degrees toward the +x-axis direction from the Earthward pointing direction (+z-axis). Each pixel of AXIS1 is staggered about the 45 degree direction in an every-other fashion. Pixel 1 is closest to the center line of the spacecraft and Pixel 8 is furtherest away; however, their ground projection is dependent on the spacecraft orientation.

There is one data file per day for the PEM AXIS1 product, and the temporal coverage is from Oct. 1, 1991 to Aug. 23, 2005. Spatial coverage for the AXIS1 product ranges between -80 and +80 degrees latitude. The AXIS1 data files are written in network binary format. For more information please review the PEM AXIS1 data format guide."
"The CAMEX-4 Conically-Scanning Two-Look Airborne Radiometer (C-STAR) dataset was collected by the Conically-Scanning Two-look Airborne Radiometer (C-STAR), which was deployed during the Fourth Convection and Moisture Experiment (CAMEX-4). C-STAR data were collected at 37GHz (in the microwave part of the electromagnetic spectrum) for the period of 8 Aug 2001 through 24 Sept 2001. The CAMEX-4 missions studied hurricanes over land and ocean in the U.S., Gulf of Mexico, Caribean, and Western Atlantic Ocean, and made use of multiple aircraft and research-quality radar, lightning, and radiosonde sites."
"The Advanced Microwave Scanning Radiometer 2 (AMSR2) instrument on the Global Change Observation Mission - Water 1 (GCOM-W1) provides global passive microwave measurements of terrestrial, oceanic, and atmospheric parameters for the investigation of global water and energy cycles.  Near real-time (NRT) products are generated within 3 hours of the last observations in the file, by the Land Atmosphere Near real-time Capability for EOS (LANCE) at the AMSR Science Investigator-led Processing System (AMSR SIPS), which is collocated with the Global Hydrology Resource Center (GHRC) DAAC.  The GCOM-W1 NRT AMSR2 Unified L2B Half-Orbit 25 km EASE-Grid Surface Soil Moisture product is a daily measurement of surface soil moisture produced by two retrieval algorithms using resampled Tb (Level-1R) data provided by JAXA: the Normalized Polarization Difference (NPD) algorithm developed by JPL and the Single Channel Algorithm (SCA) developed by USDA.  Ancillary data include time, geolocation, and quality assessment.  Data are stored in HDF-EOS5 and netCDF4 formats and are available via HTTPS from the EOSDIS LANCE system at https://lance.nsstc.nasa.gov/amsr2-science/data/level2/land/.  If data latency is not a primary concern, please consider using science quality products.  Science products are created using the best available ancillary, calibration and ephemeris information.  Science quality products are an internally consistent, well-calibrated record of the Earth's geophysical properties to support science.  The AMSR SIPS produces AMSR2 standard science quality data products and they are available at the NSIDC DAAC.  Note:  This is the same algorithm that generates the corresponding standard science products in the AMSR SIPS.  With this beta release, we are generating NRT products in both HDF-EOS5 and netCDF with CF metadata. Version 2 corrects these issues from the previous release: a boundary condition error that resulted in the failure of a small number of version 1 product files and an error in the number of low resolution scans processed which caused only the first half of each scan to be processed."
"The Seven-color Asteroid Survey(SCAS) consists of photometry in seven filters from 0.9 to 2.3 microns, of a total of 126 asteroids of types S, K, and M."
"The proposed innovation is a microfluidic device designed to effect a 2-dimensional resolution of a mixture of proteins based on isoelectric point (pI) and molecular weight (MW).  The innovation performs tasks similar to those performed by 2-dimensional (""2-D"") gel electrophoresis. To achieve 2-D-gel equivalence with minimal complications and maximum exploitation of the advantages provided by microfluidics a novel approach is proposed.  In this approach the user dissolves or mixes a sample to be tested for proteins into a sample buffer and injects this into a plastic card consisting of microfluidic channels and electrodes.  The card is inserted into a compact ""reader"" (small enough for space flight) that, within four hours, electronically reports the abundance of each protein detected.  In Phase II research SHOT will (1) establish fabrication parameters for the card and manufacture prototypes, (2) build a breadboard reader and (3) test the Microfluidic Analytical Separator using mixed protein solutions. The innovation is useful in detecting specific protein ratio changes in blood or plasma, in extracts of experimental organisms subjected to varying environmental conditions, and in the medium-resolution high-throughput screening of pharmaceutical agents."
"This data set contains complete low resolution (0.25 to 100 cm) oxygen isotope data from the WAIS Divide Ice Core WDC06A, 0 to 3404.7 m depth.  Also included is the WDC2014 timescale."
"The Ocean and Land Colour Instrument (OLCI) is the successor to ENVISAT's Medium Resolution Imaging Spectrometer (MERIS) having additional spectral channels, different camera arrangements and simplified on-board processing. The OLCI is a push-broom instrument with five camera modules sharing the field of view. The field of view of the five cameras is arranged in a fan-shaped configuration in the vertical plane, perpendicular to the platform velocity. Each camera has an individual field of view of 14.2&#186; and a 0.6&#186; overlap with its neighbors. The whole field of view is shifted across track by 12.6&#186; away from the sun to minimize the impact of sun glint. OLCI is equipped with on-board calibration hardware based on sun diffusers. There are three sun diffusers--two 'white' diffusers dedicated to radiometric calibration and one dedicated to spectral calibration, with spectral reflectance features. The native resolution is approximately 300m, refered to as Full Resolution(FR). A Reduced Resolution (RR) processing mode provides Level-1B data at sampling rates decreased by a factor of four in both spatial dimensions resulting to resolution of approximately 1.2 km."
"This data set provides sea ice extent for the Arctic (60-90 degrees North) and Antarctic (52-90 degrees South) in Scatterometer Image Reconstruction (SIR) binary image format, along with ASCII text files containing latitude and longitude coordinates along the sea ice edge, and browse images of SIR files in Graphics Interchange Format (GIF) format. Ancillary products include daily-averaged total sea ice extent in ASCII format. Estimates of sea ice extent were produced from daily-averaged QuikSCAT sigma-0 measurements and extend from 19 July 1999 to 31 December 2009.

QuikSCAT obtains 12 individual radar normalized backscatter (sigma-0) measurements, called slices, for each footprint as it scans over a 1800 km wide swath. Slices are typically 4 to 6 km long by 20 km wide. The summed measurements of the slices are called egg measurements. The effective resolution and shape of each egg measurement is approximately 20 by 30 km, depending on the antenna beam and instrument mode. This data set contains both slice and egg images for each day.

The Microwave Earth Remote Sensing (MERS) group at Brigham Young University (BYU) developed a SIR-with-filtering (SIRF) algorithm that combines forward- and aft-looking sigma-0 measurements to produce enhanced-resolution backscatter images over various azimuth angles. The polarization ratio, incidence angle dependence, and the sigma-0 estimate error standard deviation were used to discriminate between sea ice and ocean. Sea ice extent was estimated for both slice and egg images. The nominal pixel resolution of the slice images is 2.225 km with an estimated effective resolution of approximately 4 km. Egg images have a nominal pixel resolution of 4.45 km with an estimated effective resolution of approximately 8 to 10 km.

Data and browse images are available via FTP, along with C, Fortran, and Interactive Data Language (IDL) tools to read and display the SIR images."
"This project will advance optical communications interlinking between small spacecraft using pulse position modulation. The Miniature Optical Communications Transceiver (MOCT) consists of a novel software-defined pulse modulator, integrated laser system, and avalanche photodetection system. At the end of the project, MOCT will be tested for a future CubeSat flight demonstration mission."
"CRG's no-oven, no-autoclave (NONA) composite processing technology enables the fabrication of high-performance composite parts without the limitations imposed by autoclaves and ovens. The NONA infusion and cure of autoclave prepreg materials allows the manufacture of large primary composite structures without the expensive and energy-intensive capital equipment currently required for fabrication. The NONA process enables the remote fabrication of complex, integrated structures, dramatically shifting the composites manufacturing paradigm. Qualified autoclave or OoA prepreg tapes can be applied simultaneously with dry unidirectional (UD) tapes in an automated process. The presence of dry fibers throughout the layup before infusion allows improved breathing, removal of volatiles from prepreg, and improved compaction with only atmospheric pressure, mimicking the double vacuum debulk (DVD) process without the added equipment. NONA resin is then introduced to the evacuated layup at ambient temperature to wet out all available contact surfaces and cure itself and the prepreg in place. The NONA epoxy resin uses its own chemical energy to propel itself through a complete cure with no external heat required. With a high degree of crosslinking, the baseline NONA resin provides good strength, chemical resistance, and thermal performance up to 350 degrees F. Pairing NONA resin with a compatible prepreg, such as IM7/Cycom 977-3 or Hexcel IM7/8552-1, a cure of both systems can be achieved at room temperature. Because the cure occurs at room temperature, the NONA resin locks in its shape near room temperature, thus allowing the use of low-cost tooling materials, typically avoided because the of high coefficient of thermal expansion (CTE)."
"This data set contains Raw data taken by the New Horizons                Student Dust Counter                                                   instrument during the                                                    Pluto encounter                                                        mission phase.  This is VERSION 3.0 of this data set.                    This data set contains SDC observations taken during the                 the Approach (Jan-Jul, 2015), Encounter, Departure, and                  Transition mission sub-phases, including flyby observations              taken on 14 July, 2015, and departure and calibration data               through late October, 2016.  This data set completes the                 Pluto mission phase deliveries for SDC.                                  This is version 3.0 of this data set.  Changes since version 2.0         include the final batch of Pluto mission phase data, downlinked          between the end of January, 2016 and late in October, 2016, including    a Stim calibration in July.  Also, updates were made to the              documentation and catalog files, primarily to implement suggestions      from the V2.0 peer review.  A new table of SDC Ram (velocity)            ancillary data has been provided, and the SDC on/off and Stim tables     have been extended in time to cover the new data."
"This CODMAC level 5 data set contains derived data products that include pixel-precise georeferencing information, acquired by the OSIRIS Wide Angle Camera on the Rosetta spacecraft during the PRELANDING mission phase, covering the period from 2014-10-24T10:00:00.000 to 2014-11-21T23:24:59.000. The prime target is comet 67P/Churyumov-Gerasimenko 1 (1969 R1). This version V1.0 is the first version of this dataset: Lien corrected dataset after October 2018 PSA/PDS external peer review."
"During Phase I of this effort, ZONA Technology, Inc. significantly improved the medium fidelity design and analysis capability of NASA's MDAO architecture by successfully adding ZONA CAE tools such as ZAERO, ZEUS, ASTROS and ZMORPH synergistically integrated within a ModelCenter MDAO framework. In Phase II of this effort, ZONA aims to improve all the three tiers of NASA's MDAO architecture as follows: (1) The low fidelity capability will be enhanced by incorporating ZONAIR for providing flight loads (for structural design) and pressure differential (for sonic boom mitigation). ZONAIR will also 'flexiblize' rigid CFD loads for aeroelastic analyses, (2) the medium fidelity capability will be further extended by addition of new ModelCenter plug-ins and improvements in the existing plug-ins for ZONA CAE tools, for facilitating ease of design process, and (3) the high fidelity analyses capability will be augmented by the development of supportive software offering beneficial features such as automated surface+flowfield mesh morphing/generation, commonality of input within all branches of fidelity, etc. Rapid shape sensitivity generation capability will be offered with incorporation of ZEUS-DO into the framework. For ease of model-making and input setup process, a pre/post-processor software called ZONA-MV will be further improved with linkage to NASA's VSP tool. A NASTRAN-to-ASTROS finite element model converter will be developed. The overall development outcome of Phase I+II effort will then be combined as a 'ModelCenter.ZONA MDAO Pak' with on-demand cloud computing ability, unlimited tokens for massively parallelized optimization efforts, and will be perpetually licensed within all NASA Research Centers."
"<p>The current generation of spacecraft and terrestrial water recovery technologies are often prone to failures caused by biofouling and mineral scaling, which can clog mechanical systems and degrade the performance of capillary-based technologies. These failures require expensive and time-consuming maintenance and resupply, and the technologies are therefore limited to environments where these resources are available. Long duration spaceflight applications, such as extended stays at a Lunar Outpost or during a Mars transit mission, will increasingly benefit from water recovery hardware that is generally more robust and operationally sustainable over time, and that minimizes the impact of fouling and hardware failures.</p>

<p>Our proposed water recovery concept takes advantage of the partial gravity on Mars or the lunar surface, while also being microgravity compatible. This will allow for a single water recovery system for both transit and planetary mission phases. This next-generation solid-state water recovery system for spacecraft will exploit a combination of advances in three areas of research, in order to manage wastewater recovery without rotating phase separators or chemical pretreatment. These research areas are:</p>

<ol>
	<li>Capillary geometries for passive phase separation;&nbsp;</li>
	<li>Nanoparticle-enhanced pasteurization of urine wastewater through localized surface plasmon resonance in lieu of oxidizing pretreatment chemicals, thereby minimizing consumables; and</li>
	<li>Leidenfrost-mediated fouling-free capillary distillation, accomplished in a heat pipe exceeding the Leidenfrost temperature to achieve contact-free vapor generation.</li>
</ol>"
Measurements taken in the Bering Sea during 1995.
"Multi-Grid Rotating Modulation Collimators, Phase II"
"This data set contains the spectral
radiance (W/(m**2*sr*micron)) data from the Dawn VIR instrument
visible channel for all Vesta encounter mission phases. The data
cover the time period between 2011-05-03 and 2012-07-18."
"State of the art virtual reality requires low latency, on the order of single-digit milliseconds to present a scene to an operator using immersive tracking devices. In conventional teleoperation, the operator's movements are used to directly control a remote camera, requiring a fast response time to avoid simulator sickness, an approach not feasible for interplanetary robotic control with limited bandwidth, high latency communications. The proposed work develops a hybrid architecture to present a model of a coarse virtual world to an operator, while the real imagery slowly refines the presentation as bandwidth allows. An online physics engine allows an actuation command in the virtual world to be faithfully executed in the real world without direct operator feedback. The end goal is a smooth, visually realistic operator interface that allows for remote operation of an exploration vehicle in a blended world scene of virtual and actual data."
"This Phase II program will develop novel laser transmitters needed for planned airborne and space-based active remote sensing missions. This program will build on successful Phase I work to provide a Technology Readiness Level 4 (TRL-4) laboratory brassboard demonstrator of a new laser source for Differential Absorption Lidar (DIAL) measurements of atmospheric water vapor with secondary capability for methane characterization as well. Accurate measurements of both atmospheric constituents are critical to the understanding of global energy transport and climate change. Under our Phase I program, Fibertek successfully demonstrated the capability of a new laser source, a diode-pumped frequency-doubled Er:YAG laser to generate millijoule output near 823 nm that was tunable through water-vapor absorption lines for DIAL measurements. The new laser system offers simplicity and efficiency that will reduce risk for future airborne and space-based missions. Significantly, the new laser approach offers an upgrade path with reduction in size, weight, and power (SWaP) consumption over current state-of-the-art DIAL based on less-efficient non-linear parametric conversion of diode-pumped Nd:YAG lasers. This new-generation technology reduces the size and weight of flight hardware to make it compatible with affordable, more capable airborne and satellite payloads. In Phase II we propose to build on our successful Phase I demonstration to develop a full scale water vapor laser transmitter source, meeting or exceeding requirements for planned DIAL instruments."
"These are gridded Sea Surface Height Anomalies (SSHA) above a mean sea surface, on 1/6th degree grid every 5 days. It contains the fully corrected heights, but delayed 3 months. The gridded data are derived from the SSHA data of TOPEX/Poseidon, Jason-1, Jason-2 and Jason-3 as reference data from the level 2 swath data found at https://podaac.jpl.nasa.gov/dataset/MERGED_TP_J1_OSTM_OST_CYCLES_V42, plus ERS-1, ERS-2, Envisat, SARAL-AltiKa, CRyosat-2, depending on the date, from the RADS database. The gridding is done by the kriging method. The date given in the data is the center of the 5 day window."
"<p>The FMEA Assistant tool offers a new and unique approach to assist hardware developers and safety analysts perform failure analysis by using model based systems engineering concepts. Users make several selections about their component's functions and inputs/outputs, then the tool recommends for consideration a list of potential failure modes based on a common failure modes list compiled over the course of several major human spaceflight programs.  The FMEA Assistant Tool can help the hardware developer and safety analyst identify early opportunities to design out failure modes, thereby prevent the need for re-design, and can save cost and schedule. <p/><p>The FMEA Assistant guides the analyst through a set of questions about component attributes, including subsystem type, kinds of resources used, and types of outputs.  The chosen attributes narrow down the number of possible choices of failure modes that make sense for that component.   The analyst need only consider a few small sets from the full list of common failure modes to find the appropriate ones.  The dialog is dynamic, so that the choices of failure modes presented change if the analyst changes the attribute selections. The tool also has extended the use of standardization by offering short lists of common failure causes and effects for each failure mode.   Two new features have recently been added: support for choosing hazards associated with identified failure modes and effects, and a library of standard components (e.g., valve, gauge, latch) with pre-selected failure modes.   </p>"
"Spectrometers currently employed or under development by NASA are based on a printed circuit board (PCB) including field programmable arrays (FPGAs) and a number of other discrete components. An application specific integrated circuit (ASIC) based spectrometer offers a great reduction in weight, volume and power consumption compared to the FPGA/PCB based implementation. This proposal aims to develop a radiation-hardened (RH) low-power (LP) poly-phase spectrometer (PPS) ASIC. 
The proposed RH LP PPS ASIC aims to achieve a 4GHz bandwidth and 214 (16384) frequency bins. In order to implement the required functionality and meet the specifications while consuming below 2.5W of power, the proposed ASIC will include a state-of-the-art ADC, a demultiplexer, a poly-phase filter bank, a windowing function, a fast-Fourier-transform core, a fast-Fourier-data analysis block, a data readout, a digital control unit and testing features. Tolerance to at least 4Mrads of total ionizing dose (TID) radiation and immunity to the single event effects (SEEs) will be achieved by employing radiation hardening by design, by layout, and by system techniques and also by applying an ultra-thin gate oxide technology for implementation. Low power consumption will be achieved by employing special multiplier-less-accumulators and multiplier-less-""butterflies"". The power consumption will be further reduced by switching off the unused ASIC's blocks, down rating the clock frequency, eliminating unnecessary buffering and applying the 28nm CMOS technology. 
Phase I work will provide the proof of feasibility of implementing the proposed spectrometer ASIC. Phase II will result in the silicon proven ASIC's prototypes ready for commercialization in Phase III."
"AeroSoft proposes to develop a full featured CFD toolkit
for analysis of the aerothermal environment and its effect
on space vehicles.  In Phase I, AeroSoft proposes to implement
multi-component ablation along with material response into
AeroSoft's structured and unstructured CFD solver GASP.  In
Phase I, GASP's internal thermal solver will be augmented to
include the effects of ablation.    In Phase II, AeroSoft proposes
to implement radiation heat flux and radiation transport into GASP."
