"THIRN5L1CH67 is the Nimbus-5 Temperature-Humidity Infrared Radiometer (THIR) Level 1 Meteorological Radiation Data at 6.7 microns product and contains radiances expressed in units of equivalent brightness temperature measured in the 6.7 micron channel. The data, originally written on IBM 360 machines, were recovered from magnetic tapes, also referred to as Nimbus Meteorological Radiation Tapes (NMRT-THIR). The data are archived in their original IBM 36-bit word proprietary format, also referred to as a binary TAP file.

The Nimbus-5 satellite was successfully launched on December 11, 1972. The THIR experiment on Nimbus-5 continued the measurements made by its predecessor flown on Nimbus-4. The THIR instrument is a two channel high resolution scanning radiometer designed to perform two major functions:* 11.5 micron channel provides both day and night cloud top or surface temperatures. The ground resolution at the sub-point is 8 km and operates day and night.* 6.7 micron channel gives information on the moisture content of the upper troposphere and stratosphere and the location of jet streams and frontal systems. The water vapor channel has a resolution of the sub-point is 22 km and operates mostly at night.

The THIR Principal Investigator was Andrew W. McCulloch from NASA Goddard Space Flight Center. The Nimbus-5 THIR data are available from December 19, 1972 (day of year 354) through August 26, 1974 (day of year 238). The THIRN5L1CH115 product contains the 11.5 micron channel data.

This product was previously available from the NSSDC with the identifier ESAD-00167 (old ID 72-097A-08D)."
"Interest is rapidly growing in eye-safe solid-state lasers for range finding, LIDAR, infrared countermeasures, medicine, dentistry, and others. To address the need for compact, high efficiency lasers operating in this important spectral band, an ultra-compact turnkey, narrow-band, high-mode-quality, high-pulse-energy, and high-pulse-repetition-frequency (PRF), diode-pumped solid-state (DPSS) pulsed laser system will be developed that, due to superior near infrared (NIR) absorption characteristics, high phonon energies, and good thermal characteristics, can be used in an optically thin configuration, which, when properly designed, including using a directly-mounted thermally conductive index matched window, allows for very high average power in the 1500 &#150; 1600-nm spectral band. The laser is based on a new material system. The new innovative laser will be shown to best satisfy NASA remote sensing, mapping, and navigation and hazard avoidance applications by offering 0.2 mJ &#150; 2 mJ (1550 nm) at pulse rates from 10 Hz to 100 KHz.
In Phase I, existing analytical laser models will be updated, integrated with optical models, and a candidate laser design will be developed. The new laser material will then be configured in end-pumped passive- and actively-Q-switched laser designs, and the laser output as a function of pump power, pump energy, and pump repetition rate will be characterized."
"The Cassini Radio Science Saturn Ring and Atmospheric Occultation experiments (SROC15) Raw Data Archive is a time-ordered collection of radio science raw data acquired on June 4 and 28, 2012, during the Cassini Extended Mission."
Mice were flown onboard STS-135 and returned to Earth for analysis. Livers were collected within 3-4 hours of landing and snap frozen in liquid nitrogen. Samples were shipped to UCI Genomics High Throughput Facility for analysis.
"This is the CERES-MISR-MODIS_SSF-SSFM_Terra-FM1 data set. CERES-MISR_MODIS SSF-SSFM data product ntegrates measurements from Clouds and the Earth's Radiant Energy System (CERES), Multi-angle Imaging SpectroRadiometer (MISR), and Moderate Resolution Imaging Spectroradiometer (MODIS). The resulting data granule contains 2 files: an hour of instantaneous CERES SSF data which includes MODIS data and the matching CERES-MISR Single Scanner Footprint (SSFM) daytime measurements (solar zenith angle < 90 deg). MISR radiances associated with along-track CERES SSF data. Data is only available for along-track days within the temporal coverage.CERES is a key component of the Earth Observing System (EOS) program. The CERES instruments provide radiometric measurements of the Earth's atmosphere from three broadband channels. The CERES missions are a follow-on to the successful Earth Radiation Budget Experiment (ERBE) mission. The first CERES instrument (PFM) was launched on November 27, 1997 as part of the Tropical Rainfall Measuring Mission (TRMM). Two CERES instruments (FM1 and FM2) were launched into polar orbit on board the EOS flagship Terra on December 18, 1999. Two additional CERES instruments (FM3 and FM4) were launched on board EOS Aqua on May 4, 2002. The newest CERES instrument (FM5) was launched on board the Suomi National Polar-orbiting Partnership (NPP) satellite on October 28, 2011."
"MODIS/Terra Land Surface Temperature/3-Band Emissivity 8-Day L3 Global 1km SIN Grid (MOD21A2.006).

A new suite of MODIS Land Surface Temperature (LST) and Emissivity products are available in Collection 6. The MOD21 LST algorithm differs from the algorithm of the MOD11 LST products, in that the MOD21 algorithm is based on the ASTER Temperature Emissivity Separation (TES) technique, whereas the MOD11 uses the split-window technique. The MOD21 TES algorithm uses a physics-based algorithm to retrieve dynamically both the LST and Emissivity simultaneously from the three MODIS thermal infrared bands 29, 31, and 32. The TES algorithm is combined with an improved Water Vapor Scaling (WVS) atmospheric correction scheme to stabilize the retrieval during very warm and humid conditions.

The MOD21A2 dataset is an 8-day composite LST product that uses an algorithm based on a simple-averaging method. The algorithm calculates the average from all the cloud free MOD21A1D and MOD21A1N daily acquisitions from the 8-day period. Unlike the MOD21A1 data sets where the daytime and nighttime acquisitions are separate products, the MOD21A2 contains both daytime and nighttime acquisitions as separate science dataset (SDS) layers within a single Hierarchical Data Format (HDF) file. The LST, Quality Control (QC), View zenith angle, and Viewing time have separate day and night SDS layers, while the values for the MODIS emissivity bands 29, 31, and 32 are the average of both the nighttime and daytime acquisitions. Additional details regarding the method used to create this Level 3 (L3) product are available in the Algorithm Theoretical Basis Document (https://lpdaac.usgs.gov/sites/default/files/public/product_documentation/mod21_atbd.pdf).

Notification 

The Terra MODIS LST product suite (MOD21) for the 2000 through 2005 time period are being released to the public with a provisional maturity status, as these products may have been negatively impacted by an optical crosstalk issue in the IR bands (B27 - B30). Although the crosstalk issue was present from the beginning of the mission, the impact on the product is not significant until after 2005. Thus, the Terra LST products are not being produced beyond 2005. The Aqua MODIS data are not affected by this crosstalk issue and the MYD21 LST products are considered to be science quality data with a stage 1 validation status. Additional information is available on the MODIS Land Quality Assessment website (https://landweb.modaps.eosdis.nasa.gov/cgi-bin/QA_WWW/displayCase.cgi?esdt=MOD21&caseNum=PM_MOD21_18283&caseLocation=cases_data&type=C6)."
Contains oxidant flux data collected by TGB-10 for sites in the Southern Study Area.
"<p>The opportunity exists for flying and operating a geostationary gravitational wave interferometer that relies on three communication satellites (comsats). Since current drag-free designs can&#39;t provide the level of &ldquo;free-fall&quot; onboard these spacecraft because of their large size and mass, in collaboration with Stanford University we have developed a novel drag-free system that operates without the need of micro-newton (mN) thrusters. The proposed system could also be used onboard suitably designed spacecraft for future planned gravitational wave missions or for other space-based precision gravity experiments.</p> <p>Given the large volume and additional mass available for scientific use on planned commercial geostationary platforms, we have conceived an alternative drag-free design, which we have named &ldquo;Two-Stage Drag-free&rdquo;. It can be regarded as a modification of the Modular Gravitational Reference Sensor (MGRS) design developed at Stanford University during the past decade.&nbsp; Our two-stage drag-free system works in the following way. A rigid structure containing the MGRS is free-floating within the enclosure cap added to a comsat nadir deck. The free-floating spherical proof mass location, relative to the rigid structure hosting it, is measured through laser metrology; the position of the rigid structure within the enclosing cap is measured instead by a network of sensors. The sensors data is passed on to a set of cold-gas thrusters that act on the comsat to maintain its position relative to the rigid structure to within a few centimeters, while at the same time both measurements are used by a set of actuators that constantly maintain the rigid structure centered on the spherical proof mass. In our two-stage drag-free design the actuators rely on the comsat mass to react against in order to center the rigid structure on the proof-mass, thereby performing the equivalent operation of the &mu;N thrusters in the traditional drag-free design.</p>"
"Physical Sciences Inc. and Purdue University propose to develop a novel approach to scavenging heat from high intensity thermal environments encountered during space missions and converting this thermal power to electrical power at high efficiency.  Examples include extremely hot heat shields during vehicle entry into planetary atmospheres (Mars/Venus probes) and during high speed ascent through planetary atmospheres (Sample return from Mars/Venus), hot claddings of radioisotope thermoelectric generators used for powering outer planetary spacecraft and multi-decade planetary bases (Mars/Venus/Lunar), as well as combustors and nozzles of space and launch propulsion systems. In this STTR we will develop an integrated metal hydride system and spectrally-tuned thermophotovoltaic power converter system that can extract heat during periods of high thermal intensity (tens of seconds), and convert it to electricity at greater than 25 percent efficiency. Following the end of this period, the system can continue to generate useful power for additional tens of minutes.

In Phase I, for the power converter system, we will demonstrate feasibility of fabricating a critical component in larger areas (5 cm x 5 cm), and for the metal hydride (MH) system, we will experimentally characterize the MH decomposition/recombination reactions that enable continual electrical power generation for a useful duration after the period of high thermal intensity has ended.  In Phase II, we will produce an engineering prototype of the integrated heat scavenging electrical power generator system, fully tested in laboratory environment and in simulated operational thermal environment, together with an analytical model of a functional system."
"This is a Rosetta Radio Science data set, collected during the COMET ESCORT 2 phase 2015-03-11 to 2015-06-30. It is a Global Gravity measurement at the comet 67P and covers the time 2015-05-20T04:55:05.000 to 2015-05-20T06:51:25.500."
"This release contains the digital numbers (DN) contained in the telemetry (TM) packages of the VIRTIS instrument on board of the spacecraft Rosetta. This volume contains data at the vicinity of comet 67P, from the EXTENSION 1 MTP025 phase, which occurred from 2016-01-13 to 2016-02-10"
"LMOS_Ground_WDNRRoutine_Data_1 is the Lake Michigan Ozone Study (LMOS) ground site data collected at the Wisconsin Department of Natural Resources (WDNR) Routine ground site during the LMOS field campaign. This product is a result of a joint effort across multiple agencies, including NASA, NOAA, the EPA, Electric Power Research Institute (EPRI), National Science Foundation (NSF), Lake Michigan Air Directors Consortium (LADCO) and its member states, and several research groups at universities. Data collection for this product is complete.Elevated spring and summertime ozone levels remain a challenge along the coast of Lake Michigan, with a number of monitors exceeding the 2015 National Ambient Air Quality Standards (NAAQS) for ozone. The production of ozone over Lake Michigan, combined with onshore daytime “lake breeze” airflow is believed to increase ozone concentrations at locations within a few kilometers of the shore. This observed lake-shore gradient motivated the Lake Michigan Ozone Study (LMOS). Conducted from May through June 2017, the goal of LMOS was to better understand ozone formation and transport around Lake Michigan; in particular, why ozone concentrations are generally highest along the lakeshore and drop off sharply inland and why ozone concentrations peak in rural areas far from major emission sources. LMOS was a collaborative, multi-agency field study that provided extensive observational air quality and meteorology datasets through a combination of airborne, ship, mobile laboratories, and fixed ground-based observational platforms. Chemical transport models (CTMs) and meteorological forecast tools assisted in planning for day-to-day measurement strategies. The long term goals of the LMOS field study were to improve modeled ozone forecasts for this region, better understand ozone formation and transport around Lake Michigan, provide a better understanding of the lakeshore gradient in ozone concentrations (which could influence how the Environmental Protection Agency (EPA) addresses future regional ozone issues), and provide improved knowledge of how emissions influence ozone formation in the region."
"<p>Readiness of the fabrication method is needed to justify future NASA astrophysics &amp; heliophysics Missions.We propose to develop a novel optics fabrication method capable of fulfilling this demand for high-resolution, large-effective-area, affordable x-ray optics.The intent is to change the optical fabrication philosophy by starting the process with naturally-flat, thin silicon wafers and form them into very-light-weight, sub-arcsecond-resolution mirrors to be installed into a telescope structure</p> <p>The goal of this proposed study is to demonstrate viability of a novel optics fabrication method that would ultimately make high-resolution, very large effective area x-ray optics affordable. The scientific community desires sub-arcsecond angular resolution and few-square-meter-effective-area x-ray optics for future large, and mid size NASA missions. This means that future x-ray telescopes must have the same or better angular resolution and more than order of magnitude larger effective area than the Chandra Observatory, but within manageable cost budgets and mass limits. Since the cost to build the Chandra optics (0.25 arcsecond resolution and 0.08 sq. m. effective area) was $0.5 billion in 1999 prices, the use of the traditional figuring and polishing techniques to fabricate the x-ray optics for future high-resolution, large effective area instruments are cost prohibitive. Thus, the astronomical x-ray optics fabrication philosophy needs to be changed to meet the scientific community expectations. Currently, the conventional approach to building light-weight, low-cost, large-effective-area x-ray optics is to trade off angular resolution for increased mirror area through replication techniques. In these, thin optics are obtained by replication from super-polished and figured masters, then aligned and assembled into a telescope structure. During the replication process, which is done at MSFC via electroforming, small stresses are always imparted in to the shell. Separation of the thin replica from the master leads to releasing of this stress, which then results in unwanted figure deformations of the replica surface. Further, localized forces at the support points introduce additional surface deformations during the replica optics alignment process. As a result, the state-of-the-art performance for replicated optics is currently about 10 arcsecond angular resolution. Another approach to building up effective area for x-ray telescopes is to use so-called pore optics.</p>"
"In order to avoid an unintended failure in proposed Solar Sail spacecraft due to solarelastic interactions it is important to develop an analytical framework for predicting the interaction between the solar pressure and the solar membrane. I will develop a fully coupled membrane, solar pressure model that can be used to predict dynamic instabilities for Solar Sails. Many of the techniques will be directly borrowed from supersonic aeroelastic analysis but the analysis will specifically focus on proposed Solar Sails. Specifically I will couple a solar pressure model proposed by MacNeal [1] with finite element structural model of the Solar Sail to determine the critical dimensions for different solar pressure strengths. Furthermore, I will conduct non-linear structural analysis for the sails to determine the post critical behavior and ensure that the stress induced by flutter will not cause catastrophic sail failure.

In addition I will validate my theoretical model with experimentation. Because the solar pressure will not be measurable on the ground where aerodynamic forces will dominate, alternate methods of simulating the solarelastic response will be developed. For my research I will use piezoelectric patches to simulate the generalized forces in the most important structural modes. The most important structural modes will be determined by the unstable eigenvalues in the solarelastic analysis and the critical mode shape from the corresponding eigenfuctions. As with the theoretical analysis, initial simulations will be done on the simply supported rectangle case.

[1] MacNeal, R. H., Structural Dynamcis of the Heliogyro, NASA CR-1745, 1971"
"The goal is to enable electronic beam scanning of submillimeter-wave instruments including radars, radiometers and spectrometers."
"<p>Measurements in NASA's wind tunnels generally consist of force and moment and on-body measurements like surface pressure, surface deflection or heat transfer to the surface.  Detailed off-body measurements are needed to understand complex wind tunnel flows and to provide data to validate high-fidelity computational models. Most existing techniques capable of measuring detailed off-body flows, for example, particle image velocimetry, require particle or gas seeding which is not possible in many of NASA's tunnels. In this project, two techniques utilizing new femtosecond laser technology will be investigated. Both techniques show promise of measuring multiple parameters quantitatively in unseeded wind tunnel flows. The femtosecond laser electronic excitation and tagging (FLEET) technique can measure velocity and potentially pressure and temperature simultaneously. The femtosecond coherent anti-Stokes Raman spectroscopy (FS-CARS) technique can measure pressure, temperature and species concentrations. The two techniques have relative advantages and limitations that will be explored.  The objective of this research project is to leverage recent advancements in laser technology and recent discoveries in academia to discover and apply new ways of measuring aerospace flows. In particular, methods of measuring the gas velocity, pressure, temperature and concentration will be developed. The two different measurement techniques share a common femtosecond laser technology and can be used separately or together to measure multiple gas properties simultaneously in wind tunnel flows and possibly in flight. In this project, we are extending the ability of FLEET to measure multiple parameters such as pressure and temperature simultaneous with velocity.  These additional parameters will be obtained by observing and interpreting the amplitude and spectrum of the FLEET signal.  The main novelty of the proposed work is that FLEET should allow velocity to be measured in several facilities where velocity cannot be curren</p>"
"<p>Detector technology for NASA applications is progressing to more complex multilayer circuits to gain advances in array size or detector performance. Chemical Mechanical Planarization (CMP) is a technique that maintains high fabrication yield and increases feature density in multilayer structures. While outside foundries offer CMP for a limited set of materials, we propose to leverage in-house and federal government facilities to develop custom CMP techniques for the specific materials we need, thereby enabling breakthrough enhancements in detectors, multiplexers, and microwave devices for astrophysics missions.</p>"
"This derived product set consists of Global Navigation Satellite System Ionosphere Vertical Total Electron Content (VTEC) comparison product (daily files) from the NASA Crustal Dynamics Data Information System (CDDIS). GNSS provide autonomous geo-spatial positioning with global coverage. GNSS data sets from ground receivers at the CDDIS consist primarily of the data from the U.S. Global Positioning System (GPS) and the Russian GLObal NAvigation Satellite System (GLONASS). Since 2011, the CDDIS GNSS archive includes data from other GNSS (Europe’s Galileo, China’s Beidou, Japan’s Quasi-Zenith Satellite System/QZSS, the Indian Regional Navigation Satellite System/IRNSS, and worldwide Satellite Based Augmentation Systems/SBASs), which are similar to the U.S. GPS in terms of the satellite constellation, orbits, and signal structure. GNSS observations from a global network can be utilized for atmospheric measurements. Analysis Centers (ACs) of the International GNSS Service (IGS) retrieve GNSS data on regular schedules to produce independently computed VTEC maps. The IGS Ionosphere Analysis Center Coordinator (ACC) uses these individual AC solutions to generate the official IGS VTEC maps. The validation products are used to compare the IGS and AC solutions of generated VTEC maps. There are three types of ionosphere product evaluation/validation products: 1) the upcwWWWW.YYv.Z files provide an evaluation of the final weekly combination solution of VTEC maps with the individual analysis center contributions; 2) the gpsgDDD0.YYi.Z files are provided by the Center for Orbit Determinate (CODE) at the Astronomical Institute at the University of Bern (AIUB) Switzerland; these files contain GPS broadcast ionosphere model for day YYDDD; and 3) the ckmgDDD0.YYi.Z products are computed by CODE using their Klobuchar model, best fitting CODE’s final ionosphere solution, also available from the CDDIS."
"The PV-OIMS low resolution dataset contains data from the Orbiter Ion Mass Spectrometer (OIMS) experiment for orbits 1-2996, including data for the period periapsis +/- 30 minutes for each orbit. The dataset is divided into multiple files, each of which contains 1 orbit."
"This data set includes Voyager 2 Jupiter encounter magnetometer data from the Low Field Magnetometer (LFM) resampled at a 48 second sample rate. The data are given in Jovicentric System III right handed coordinates and have been averaged from the 60 ms instrument sample rate to a 48 second resampled rate. Ephemeris data, provided in 96 second sampled System III (1965) coordinates, have been merged into the data files for this data set. The ephemeris data, generated from Voyager 2 SEDR and provided by the Voyager MAG Team, are part of the data set VG2-J-POS-6-SUMM-S3COORDS-V1.1. The position vectors for times at which ephemeris is not provided have been flagged."
"This data set contains satellite-retrieved geophysical parameter files generated from the Advanced Microwave Scanning Radiometer - Earth Observing System (AMSR-E) instrument on the National Aeronautics and Space Administration (NASA) Aqua satellite and the Advanced Microwave Scanning Radiometer 2 (AMSR2) sensor on the JAXA GCOM-W1 satellite. The geophysical parameters include daily air surface temperature, fractional open water cover estimates, vegetation optical depth, surface volumetric soil moisture, and atmosphere total column precipitable water vapor. The global retrievals were derived over land for non-precipitating, non-snow, and non-ice covered conditions."
